[
  {
    "title": "Exciting Announcement: iWorkflow System Deployment Success",
    "slug": "exciting-announcement-iworkflow-system-deployment-success",
    "date": "2026-03-04",
    "tags": [
      "iWorkflow",
      "automation",
      "deployment"
    ]
  },
  {
    "title": "Grieving and Grocery Stores: Finding Solace in H-Mart",
    "slug": "grieving-and-grocery-stores-finding-solace-in-h-mart",
    "date": "2026-03-04",
    "tags": [
      "grief",
      "personal-experience",
      "asian-culture"
    ]
  },
  {
    "title": "Exciting Announcement: Successful Deployment of Our Denermanistic Slug Workflow System",
    "slug": "2026-03-04-exciting-announcement-successful-deployment-of-our-denermanistic-slug-workflow-system",
    "date": "2026-03-04",
    "tags": [
      "Denermanistic Slug",
      "workflow",
      "deployment"
    ]
  },
  {
    "title": "The Future of Writing: Conversational Interfaces and Voice-Driven Publishing",
    "slug": "2026-03-04-the-future-of-writing-conversational-interfaces-and-voice-driven-publishing",
    "date": "2026-03-04",
    "tags": [
      "technology",
      "writing",
      "AI",
      "voice interfaces"
    ]
  },
  {
    "title": "Understanding the Role of Disclaimer Notices in Fictional Media",
    "slug": "2026-03-04-understanding-the-role-of-disclaimer-notices-in-fictional-media",
    "date": "2026-03-04",
    "tags": [
      "fiction",
      "disclaimer",
      "media"
    ]
  },
  {
    "title": "The Future of Writing: Conversations as Content",
    "slug": "2026-03-04-the-future-of-writing-conversations-as-content",
    "date": "2026-03-04",
    "tags": [
      "voice-tech",
      "future-of-writing"
    ]
  },
  {
    "title": "The Evolution of Writing: From Blank Pages to Conversational Interfaces",
    "slug": "2026-03-04-the-evolution-of-writing-from-blank-pages-to-conversational-interfaces",
    "date": "2026-03-04",
    "tags": [
      "writing",
      "technology",
      "AI"
    ]
  },
  {
    "title": "Example Post",
    "date": "2026-02-25",
    "slug": "2026-02-25-example-post",
    "tags": [
      "AI"
    ]
  }
]